{"access_log":[{"action":"metadata_read","actor":"a9c-metadata-freeze","object_sha256":"121a5141477ca23ad26fb6618edf8f71c85e72eda11bec893a81e7895a9dd5e8","timestamp":"2026-07-15T22:00:00Z"}],"confirmation_access_state":"metadata_only","created_at":"2026-07-15T22:00:00Z","exposed_logical_records":[{"access_state":"available","calendar":"daymet_official_365_v1","day_boundary":"civil_daymet","logical_sha256":"6ade9dc9aeac9e97ad538a1c19481bbbbec0f05dbde11a170578d03febd109bd","object_sha256":"e6b89240518e390317a30f19b5240131ae70a9ef247e4e66037a757f2a8492f0","period_end":"2009-12-31","period_start":"1980-01-01","product_version":"V4 R1 / 4.1","source_id":"daymet","station_id":"az026481","variables":["prcp","tmax","tmin"]},{"access_state":"available","calendar":"daymet_official_365_v1","day_boundary":"civil_daymet","logical_sha256":"d1bc1557e4e757836cf082878cd9c1c516f14d2aef0e8909b3013c554694b9a8","object_sha256":"450f3d17f8a9ecce439d8a17349d7017ca183fb09b5cf2c37faad0a5d0b0af25","period_end":"2009-12-31","period_start":"1980-01-01","product_version":"V4 R1 / 4.1","source_id":"daymet","station_id":"az028820","variables":["prcp","tmax","tmin"]},{"access_state":"available","calendar":"daymet_official_365_v1","day_boundary":"civil_daymet","logical_sha256":"0fa7b1e764711458947f0df495c5e17ee827d9fdc20aeea5b4912b78482b2398","object_sha256":"8b9ec4d0231f11580872db9fd159f9268e6629ab989aaf295a62f8421d24e5a1","period_end":"2009-12-31","period_start":"1980-01-01","product_version":"V4 R1 / 4.1","source_id":"daymet","station_id":"ca040442","variables":["prcp","tmax","tmin"]},{"access_state":"available","calendar":"daymet_official_365_v1","day_boundary":"civil_daymet","logical_sha256":"08e55cc8de3879466d5139c3f92b9dc884410cd731af70c8f2e7050ccc79c85e","object_sha256":"8ab026188710905786cd1d91db1e47a453fc2830f29bc627d51b2703a349bfec","period_end":"2009-12-31","period_start":"1980-01-01","product_version":"V4 R1 / 4.1","source_id":"daymet","station_id":"ca042713","variables":["prcp","tmax","tmin"]},{"access_state":"available","calendar":"daymet_official_365_v1","day_boundary":"civil_daymet","logical_sha256":"017473aec5f547bba3e226159e2e2274a6c92142890dd7c792280692cc60d43a","object_sha256":"0b9a48b7e11a98bdb714f16c8f6dfd4f2241cf0bf5a43a83a6d20c49ee1f896d","period_end":"2009-12-31","period_start":"1980-01-01","product_version":"V4 R1 / 4.1","source_id":"daymet","station_id":"co050130","variables":["prcp","tmax","tmin"]},{"access_state":"available","calendar":"daymet_official_365_v1","day_boundary":"civil_daymet","logical_sha256":"78bb9eef7fc0944b7d7d0fb6aaca4551dbb5146e06293625b301e963c897f258","object_sha256":"047178da7ad38d772eb93bdc5e8a88d72de887940d38505a0f5bd827a238f009","period_end":"2009-12-31","period_start":"1980-01-01","product_version":"V4 R1 / 4.1","source_id":"daymet","station_id":"id101022","variables":["prcp","tmax","tmin"]},{"access_state":"available","calendar":"daymet_official_365_v1","day_boundary":"civil_daymet","logical_sha256":"d4c811edb1304d2af021c02d7ff1ba6f25cb31d8bbd45a2cc5e11503e5167855","object_sha256":"28e7479b3b0355e3edad768b526fa2cef48e751bed82b1f059b18bbbbb38b9e3","period_end":"2009-12-31","period_start":"1980-01-01","product_version":"V4 R1 / 4.1","source_id":"daymet","station_id":"la160549","variables":["prcp","tmax","tmin"]},{"access_state":"available","calendar":"daymet_official_365_v1","day_boundary":"civil_daymet","logical_sha256":"47d9ce3ee2bdcf245545c7edc3e49fc66c9790ab81c3af70281fa988712b954c","object_sha256":"617fa5b398f82a8ed696fc5cac7b11c900bcf97e75904ecc039b710e7dfb043d","period_end":"2009-12-31","period_start":"1980-01-01","product_version":"V4 R1 / 4.1","source_id":"daymet","station_id":"me171175","variables":["prcp","tmax","tmin"]},{"access_state":"available","calendar":"daymet_official_365_v1","day_boundary":"civil_daymet","logical_sha256":"4fe2c03d05e90919a27fc8873706c944851b9de1bae6943068f95a4fceebba11","object_sha256":"24d9afb9bb849e481e6c7ef0469680e90a33e9581bed6e58726baeaab368f4cd","period_end":"2009-12-31","period_start":"1980-01-01","product_version":"V4 R1 / 4.1","source_id":"daymet","station_id":"mn212248","variables":["prcp","tmax","tmin"]},{"access_state":"available","calendar":"daymet_official_365_v1","day_boundary":"civil_daymet","logical_sha256":"a75c7ff9607ea752234cfaba1d029da1666024215e3abba0f7a61904dfe11ea1","object_sha256":"f981bef27b055acd11fd2c7ac78fce3ff9c093db2c31b3544b879fe632b235be","period_end":"2009-12-31","period_start":"1980-01-01","product_version":"V4 R1 / 4.1","source_id":"daymet","station_id":"mt243996","variables":["prcp","tmax","tmin"]},{"access_state":"available","calendar":"daymet_official_365_v1","day_boundary":"civil_daymet","logical_sha256":"1633f5b7893baf24aeb989737f5698fb81b13d4b6109732cc65bb83b1a74d0b8","object_sha256":"a3854f4f4cde6e91a096e7d88a96e79c615c4b16e999f12652db5cbb63f6a06f","period_end":"2009-12-31","period_start":"1980-01-01","product_version":"V4 R1 / 4.1","source_id":"daymet","station_id":"ne257665","variables":["prcp","tmax","tmin"]},{"access_state":"available","calendar":"daymet_official_365_v1","day_boundary":"civil_daymet","logical_sha256":"c00d2eb90311819d93f6ed5344162723220a831fc110ef65c5fe0fa37a5bfd74","object_sha256":"388f42026c43540945a7b6ca552ead07a2f6bc9e7a4046ad193e53776692a4c0","period_end":"2009-12-31","period_start":"1980-01-01","product_version":"V4 R1 / 4.1","source_id":"daymet","station_id":"nm290234","variables":["prcp","tmax","tmin"]},{"access_state":"available","calendar":"daymet_official_365_v1","day_boundary":"civil_daymet","logical_sha256":"7a5d078469d751add5a533e83276b19b63ac2b1bdf1c936ad99a1452cf3426bd","object_sha256":"1b1dc4070d0e93ea6c7611938b1d4c08700f67b5b7afd5d0b7b6db3a591ac087","period_end":"2009-12-31","period_start":"1980-01-01","product_version":"V4 R1 / 4.1","source_id":"daymet","station_id":"nv262631","variables":["prcp","tmax","tmin"]},{"access_state":"available","calendar":"daymet_official_365_v1","day_boundary":"civil_daymet","logical_sha256":"b8076a57ca5792e830666d733b093bb2947035e7e090ecbe0029b933d710f5d0","object_sha256":"b32ca89440e99c5c777b66dd66daaa6d2630228e817e48c079186843a5cb12a9","period_end":"2009-12-31","period_start":"1980-01-01","product_version":"V4 R1 / 4.1","source_id":"daymet","station_id":"nv264436","variables":["prcp","tmax","tmin"]},{"access_state":"available","calendar":"daymet_official_365_v1","day_boundary":"civil_daymet","logical_sha256":"fb893099f40ffaaad3bef343abcb53a22ee07d9ac82ac694949e636524d01aa6","object_sha256":"d0cc2b552329bfd6c2b50a8e104058b3a17baafa04bea62902385a873685682c","period_end":"2009-12-31","period_start":"1980-01-01","product_version":"V4 R1 / 4.1","source_id":"daymet","station_id":"nv269171","variables":["prcp","tmax","tmin"]},{"access_state":"available","calendar":"daymet_official_365_v1","day_boundary":"civil_daymet","logical_sha256":"430fc0218eeeb9dfeaf7279895cb7bc6e522296b7011433d1a2a70f571b29719","object_sha256":"babddfc446d8bb2cfee67fd09513e03e2986ab320cdebd646932496613b6ec5d","period_end":"2009-12-31","period_start":"1980-01-01","product_version":"V4 R1 / 4.1","source_id":"daymet","station_id":"or350412","variables":["prcp","tmax","tmin"]},{"access_state":"available","calendar":"daymet_official_365_v1","day_boundary":"civil_daymet","logical_sha256":"2e11fe70aab1dcda94c4c076e9f56d7941d36f660e9dc28c11c7f2742ee3b3fa","object_sha256":"4fd9a7ff933b47c0709999672f550e39ca24ea4348570d1975bf17faa1db5f17","period_end":"2009-12-31","period_start":"1980-01-01","product_version":"V4 R1 / 4.1","source_id":"daymet","station_id":"sc381544","variables":["prcp","tmax","tmin"]},{"access_state":"available","calendar":"daymet_official_365_v1","day_boundary":"civil_daymet","logical_sha256":"8f894ddae7ad92c1feff59a060d0a4cd885cc08889384dc0c90dff4df8078445","object_sha256":"6f72c2f32fff64e57302fed0efa0b968b93c62b7cc28e5c7b191001e13273628","period_end":"2009-12-31","period_start":"1980-01-01","product_version":"V4 R1 / 4.1","source_id":"daymet","station_id":"tx413280","variables":["prcp","tmax","tmin"]},{"access_state":"available","calendar":"daymet_official_365_v1","day_boundary":"civil_daymet","logical_sha256":"c3897a1174676487eab8b2b3252618b71984d51f44ea2b3fff9eebbe763c8831","object_sha256":"3184da8904d7e7152fd2140cadc0ab29918decf74ce306f5f6fbb89b7d1df7ae","period_end":"2009-12-31","period_start":"1980-01-01","product_version":"V4 R1 / 4.1","source_id":"daymet","station_id":"tx417262","variables":["prcp","tmax","tmin"]},{"access_state":"available","calendar":"daymet_official_365_v1","day_boundary":"civil_daymet","logical_sha256":"4d5f38a92fda87e9a075961000e180bc1a803433d84d2350b954244893949a23","object_sha256":"917bbf0f856aac8992b6c5e691960d144225fcde96a0038353dc9ce4eb3a6991","period_end":"2009-12-31","period_start":"1980-01-01","product_version":"V4 R1 / 4.1","source_id":"daymet","station_id":"wy487845","variables":["prcp","tmax","tmin"]},{"access_state":"available","calendar":"gregorian","day_boundary":"local_standard_time","logical_sha256":"121fc64ee23ed36cb96be026c87a5c9c8968655483f04ddeeb4efe7cc63f62b4","object_sha256":"0155a77843e44725f91d707502427253d573f3d09cf9868f791846147209e930","period_end":"2017-12-31","period_start":"2010-01-01","product_version":"Subhourly01 format 01 / OAP 2.1.1 archive","source_id":"uscrn_subhourly01","station_id":"al_fairhope_3_ne","variables":["precip_5min_mm","air_temperature_c","solar_radiation_w_m2","relative_humidity_pct","wetness","wind_speed_1_5m_m_s"]},{"access_state":"available","calendar":"gregorian","day_boundary":"local_standard_time","logical_sha256":"e3c044f56017e5ba6330d21003291fd7425a01a4ce6cded33ca94ec9a2e01d8e","object_sha256":"a6deb432469c5c0c74c27f749880e1ce458c66b148da481908131acf60275ef0","period_end":"2017-12-31","period_start":"2010-01-01","product_version":"Subhourly01 format 01 / OAP 2.1.1 archive","source_id":"uscrn_subhourly01","station_id":"az_tucson_11_w","variables":["precip_5min_mm","air_temperature_c","solar_radiation_w_m2","relative_humidity_pct","wetness","wind_speed_1_5m_m_s"]},{"access_sta